caption_sentence,cleaned_tokens
brilliant will make you a better thinker brilliant will make you a better thinker and Problem Solver with thousands of and Problem Solver with thousands of,"['brilliant', 'make', 'better', 'thinker', 'brilliant', 'make', 'better', 'thinker', 'problem', 'solver', 'thousand', 'problem', 'solver', 'thousand']"
and Problem Solver with thousands of Hands-On lessons on just about anything Hands-On lessons on just about anything Hands-On lessons on just about anything you may be curious about they recently,"['problem', 'solver', 'thousand', 'handson', 'lesson', 'anything', 'handson', 'lesson', 'anything', 'handson', 'lesson', 'anything', 'may', 'curious', 'recently']"
you may be curious about they recently you may be curious about they recently launched a whole new suite of data launched a whole new suite of data,"['may', 'curious', 'recently', 'may', 'curious', 'recently', 'launched', 'whole', 'new', 'suite', 'data', 'launched', 'whole', 'new', 'suite', 'data']"
launched a whole new suite of data courses that use real data to tell courses that use real data to tell courses that use real data to tell powerful stories while training your,"['launched', 'whole', 'new', 'suite', 'data', 'course', 'use', 'real', 'data', 'tell', 'course', 'use', 'real', 'data', 'tell', 'course', 'use', 'real', 'data', 'tell', 'powerful', 'story', 'training']"
powerful stories while training your powerful stories while training your brain to see Trends through the chaos of brain to see Trends through the chaos of,"['powerful', 'story', 'training', 'powerful', 'story', 'training', 'brain', 'see', 'trend', 'chaos', 'brain', 'see', 'trend', 'chaos']"
brain to see Trends through the chaos of truly massive data sets you'll answer truly massive data sets you'll answer truly massive data sets you'll answer practical questions like how to maximize,"['brain', 'see', 'trend', 'chaos', 'truly', 'massive', 'data', 'set', 'youll', 'answer', 'truly', 'massive', 'data', 'set', 'youll', 'answer', 'truly', 'massive', 'data', 'set', 'youll', 'answer', 'practical', 'question', 'like', 'maximize']"
practical questions like how to maximize practical questions like how to maximize Revenue hosting on Airbnb using the same Revenue hosting on Airbnb using the same,"['practical', 'question', 'like', 'maximize', 'practical', 'question', 'like', 'maximize', 'revenue', 'hosting', 'airbnb', 'using', 'revenue', 'hosting', 'airbnb', 'using']"
Revenue hosting on Airbnb using the same analysis techniques that scientists use analysis techniques that scientists use analysis techniques that scientists use to explore the distribution of galaxies,"['revenue', 'hosting', 'airbnb', 'using', 'analysis', 'technique', 'scientist', 'use', 'analysis', 'technique', 'scientist', 'use', 'analysis', 'technique', 'scientist', 'use', 'explore', 'distribution', 'galaxy']"
to explore the distribution of galaxies to explore the distribution of galaxies and unravel the mysteries of the cosmos and unravel the mysteries of the cosmos,"['explore', 'distribution', 'galaxy', 'explore', 'distribution', 'galaxy', 'unravel', 'mystery', 'cosmos', 'unravel', 'mystery', 'cosmos']"
and unravel the mysteries of the cosmos A Foundation that can take your A Foundation that can take your A Foundation that can take your understanding to astronomical Heights,"['unravel', 'mystery', 'cosmos', 'foundation', 'take', 'foundation', 'take', 'foundation', 'take', 'understanding', 'astronomical', 'height']"
understanding to astronomical Heights understanding to astronomical Heights we've also partnered with brilliant to we've also partnered with brilliant to we've also partnered with brilliant to create a series of lessons to take your,"['understanding', 'astronomical', 'height', 'understanding', 'astronomical', 'height', 'weve', 'also', 'partnered', 'brilliant', 'weve', 'also', 'partnered', 'brilliant', 'weve', 'also', 'partnered', 'brilliant', 'create', 'series', 'lesson', 'take']"
create a series of lessons to take your create a series of lessons to take your scientific knowledge to the next level scientific knowledge to the next level,"['create', 'series', 'lesson', 'take', 'create', 'series', 'lesson', 'take', 'scientific', 'knowledge', 'next', 'level', 'scientific', 'knowledge', 'next', 'level']"
scientific knowledge to the next level these lessons let you further explore these lessons let you further explore these lessons let you further explore the topics in our most popular videos,"['scientific', 'knowledge', 'next', 'level', 'lesson', 'let', 'explore', 'lesson', 'let', 'explore', 'lesson', 'let', 'explore', 'topic', 'popular', 'video']"
the topics in our most popular videos the topics in our most popular videos from rabis and mamalian Metabolism to from rabis and mamalian Metabolism to,"['topic', 'popular', 'video', 'topic', 'popular', 'video', 'rabis', 'mamalian', 'metabolism', 'rabis', 'mamalian', 'metabolism']"
from rabis and mamalian Metabolism to climate science and supern noi each climate science and supern noi each climate science and supern noi each lesson on brilliant is interactive like,"['rabis', 'mamalian', 'metabolism', 'climate', 'science', 'supern', 'noi', 'climate', 'science', 'supern', 'noi', 'climate', 'science', 'supern', 'noi', 'lesson', 'brilliant', 'interactive', 'like']"
lesson on brilliant is interactive like lesson on brilliant is interactive like a one-on-one version of a cot gazar a one-on-one version of a cot gazar,"['lesson', 'brilliant', 'interactive', 'like', 'lesson', 'brilliant', 'interactive', 'like', 'oneonone', 'version', 'cot', 'gazar', 'oneonone', 'version', 'cot', 'gazar']"
a one-on-one version of a cot gazar video and you can get started Whenever video and you can get started Whenever video and you can get started Whenever Wherever right from whatever device,"['oneonone', 'version', 'cot', 'gazar', 'video', 'get', 'started', 'whenever', 'video', 'get', 'started', 'whenever', 'video', 'get', 'started', 'whenever', 'wherever', 'right', 'whatever', 'device']"
Wherever right from whatever device Wherever right from whatever device you'd like to get handson with csar you'd like to get handson with csar you'd like to get handson with csar lessons and explore everything brilliant,"['wherever', 'right', 'whatever', 'device', 'wherever', 'right', 'whatever', 'device', 'youd', 'like', 'get', 'handson', 'csar', 'youd', 'like', 'get', 'handson', 'csar', 'youd', 'like', 'get', 'handson', 'csar', 'lesson', 'explore', 'everything', 'brilliant']"
lessons and explore everything brilliant lessons and explore everything brilliant has to offer you can start your free has to offer you can start your free,"['lesson', 'explore', 'everything', 'brilliant', 'lesson', 'explore', 'everything', 'brilliant', 'offer', 'start', 'free', 'offer', 'start', 'free']"
has to offer you can start your free 30-day trial by signing up at 30-day trial by signing up at 30-day trial by signing up at brilliant.org,"['offer', 'start', 'free', 'day', 'trial', 'signing', 'day', 'trial', 'signing', 'day', 'trial', 'signing', 'brilliantorg']"
brilliant.org brilliant.org nutshell there's even an extra perk for nutshell there's even an extra perk for nutshell there's even an extra perk for gazak viewers the first 200 people to,"['brilliantorg', 'brilliantorg', 'nutshell', 'there', 'even', 'extra', 'perk', 'nutshell', 'there', 'even', 'extra', 'perk', 'nutshell', 'there', 'even', 'extra', 'perk', 'gazak', 'viewer', 'first', 'people']"
gazak viewers the first 200 people to gazak viewers the first 200 people to use the link get 20% off an annual use the link get 20% off an annual,"['gazak', 'viewer', 'first', 'people', 'gazak', 'viewer', 'first', 'people', 'use', 'link', 'get', 'annual', 'use', 'link', 'get', 'annual']"
use the link get 20% off an annual membership once their trial,"['use', 'link', 'get', 'annual', 'membership', 'trial']"
